<?xml version="1.0" encoding="UTF-8"?>

<raiz xmlns="http://www.example.org/xmlSchemaDefinition"
      xmlns:xsi="http://www.w3.org/2001/XMLSchema-instance"
      xsi:schemaLocation="http://www.example.org/xmlSchemaDefinition xmlSchemaDefinition.xsd">

	<nombre>Bart</nombre>
	<altura>10.5</altura>
	<cantidad>20</cantidad>
	<fecha>2017-05-29</fecha>
	
	<sioque></sioque>

	<colorTexto></colorTexto> <!-- Rojo -->
	<colorTexto>Verde</colorTexto>
	
	<colorFondo></colorFondo>
	<colorFondo>blanco</colorFondo>
	<!-- <colorFondo>azul</colorFondo> -->

	<anchura>10</anchura>
	<coche>Authi</coche>
	
	<letraMinuscula>ñ-9</letraMinuscula>
	<password>12345678</password>

	<empleado>
		<nombre>Bender</nombre>
		<apellidos>Bending Rodriguez</apellidos>
	</empleado>
	
	<profesor>
		<nombre>Luis Ramón</nombre>
		<apellidos>Álvarez González</apellidos>
	</profesor>
	<alumno>
		<nombre>Luis Ramón</nombre>
		<apellidos>Álvarez González</apellidos>
	</alumno>
	
	<camion>
		<marca>Pegaso</marca>
		<modelo>Troner</modelo>
		<volumenCarga>20</volumenCarga>
		<pesoCarga>20</pesoCarga>
	</camion>
	<moto>
		<marca>Yamaha</marca>
		<modelo>FZR</modelo>
	</moto>

	<producto id="123" fabricante="Tal"/>

	<recordatorio idEmpleado="42">
		Texto
	</recordatorio>
	
	<libro ISBN="123">
		<titulo>El quijote</titulo>
		<autor>Cervantes</autor>
	</libro>
	
	<carta>
		Estimado <nombre>Peter Venkman</nombre>.
		Su pedido con código <codPedido>127</codPedido>
		se enviará con fecha <fecha>2017-01-01</fecha>
	</carta>
	
	<documento>
		<creador>Groucho</creador>
		<validador>Harpo</validador>
		<validador>Chico</validador>
		<notas>
			Contrato
		</notas>
	</documento>
	
	<cliente>
		<nombre>Cliente</nombre>
		<ciudad>Madrid</ciudad>
		<calle>C/Barquillo</calle>
		<numero>20</numero>
	</cliente>

	<post fechaCreacion="2017-01-01" fechaModificacion="2017-01-01" fechaAcceso="2017-01-01">
		<autor>Johnny Cab</autor>
		<contenido>
			Bla bla blá
		</contenido>
	</post>
	
	<pelicula>
		<titulo>T1</titulo>
		<director>James Cameron</director>
	</pelicula>
	<pelicula>
		<director>James Cameron</director>
		<titulo>Abyss</titulo>
	</pelicula>

	<curso>
		<titulo>XML</titulo>
		<pelicula>
			<titulo>T1</titulo>
			<director>James Cameron</director>
		</pelicula>
	</curso>
	<curso>
		<titulo>Spring</titulo>
		<moto>
			<marca>Yamaha</marca>
			<modelo>FZR</modelo>
		</moto>		
	</curso>
	
	<proveedor>
		<nombre></nombre>
	</proveedor>
	<provider>
		<nombre></nombre>
	</provider>
	
</raiz>












